No,Name,NickName,GENDER,ELEMENT,POSITION,ROLE,AGE_GROUP,SCHOOL_YEAR,TEAM,OBTAIN,IE1,IE2,IE3,GO1,GO2,GO3,ARS,ORI,VIC,KICK,CONTROL,TECHNIQUE,PRESSURE,PHYSICAL,AGILITY,INTELLIGENCE,SHOT,FOCUS(AT),FOCUS(DF),SCRAMBLE(AT),SCRAMBLE(DF),SHOT_BLOCK,KEEPER_POWER
2589,北厳 猛雪,北厳,男,風,DF,選手,中学生,三年生,白恋中,スコップ一つで　あっという間に町内の雪を片付けてしまう　雪かきの名人。,×,×,×,○,○,○,×,×,○,79,83,84,91,95,81,104,162,187,188,199,195,186,791
2590,伊富 寅太,伊富,男,山,DF,選手,中学生,二年生,白恋中/革命選抜チーム,焼き鮭の味に感銘を受けて以来　ずっと鮭の生態について　研究をしている。,×,×,×,○,○,○,×,×,○,76,79,77,95,99,81,110,155,189,187,209,205,194,811
2591,小樽 港太郎,小樽,男,林,DF,選手,中学生,二年生,白恋中,放課後は　筋力トレーニングも兼ねて近くの港で　船の積み荷を手伝っている。,×,×,×,○,○,○,×,×,○,79,83,84,91,95,81,104,162,187,188,199,195,186,791
2592,真狩 銀次郎,真狩,男,風,DF,選手,中学生,一年生,白恋中/革命選抜チーム/レジスタンスジャパン,地元で有名なユリ農家で球根はいつもプレミア価格になる。,×,×,×,○,○,○,×,×,○,83,86,88,95,99,85,107,169,193,195,206,202,194,827
2593,木瀧 常緒,木瀧,男,火,MF,選手,中学生,一年生,白恋中/革命選抜チーム,野生動物にエサを与えないよう呼びかけ観光客のマナーアップを目指している。,×,×,×,○,○,○,×,×,○,90,104,105,77,75,75,93,194,197,198,168,170,152,679
2594,洞爺 国広,洞爺,男,火,MF,選手,中学生,二年生,白恋中,凍った湖での　ワカサギ釣りが趣味。華麗な足技で　氷に穴を開けるという。,×,×,×,○,○,○,×,×,○,90,104,105,77,75,75,93,194,197,198,168,170,152,679
2595,氷里 樹,氷里,男,風,MF,選手,中学生,二年生,白恋中,雪山を訪れては　樹氷の写真を撮っている。その数はついに２０００枚を超えたという。,×,×,×,○,○,○,×,×,○,90,104,105,77,75,75,93,194,197,198,168,170,152,679
2596,留萌 頃彦,留萌,男,林,MF,選手,中学生,一年生,白恋中,真冬の川で平然と泳ぐ　すごいヤツ。ニシンとカズノコが　彼の元気の源。,×,×,×,○,○,○,×,×,○,90,104,105,77,75,75,93,194,197,198,168,170,152,679
2597,雪村 豹牙,雪村,男,風,FW,選手,中学生,二年生,白恋中/革命選抜チーム/レジスタンスジャパン,白恋ＯＢの吹雪に　その才能を見出された北国屈指のスーパーストライカーだ。,×,×,×,○,○,○,×,×,○,117,112,102,84,82,81,90,229,202,192,172,174,166,738
2598,射月 冬馬,射月,男,林,FW,選手,中学生,一年生,白恋中,本来はスピードスケートの選手。その足腰の強さはハンパじゃない。,×,×,×,○,○,○,×,×,○,104,101,91,81,78,75,90,205,191,181,168,171,159,696
2599,最崎 至,最崎,男,山,GK,選手,中学生,一年生,白恋中,日本の最東端からやって来た少年。心の底から　世界の平和を願っている。,×,×,×,○,○,○,×,×,○,79,86,81,88,95,101,86,165,172,167,181,174,183,865
2600,王鹿 角,王鹿,男,山,DF,選手,中学生,二年生,白恋中,生態系を守るために　できることを考えとりあえず　エゾシカの観察を始めた。,×,×,×,○,○,○,×,×,○,79,83,84,91,95,81,104,162,187,188,199,195,186,791
2601,山音 実里,ヤマネ,男,山,MF,選手,中学生,一年生,白恋中,猿に負けずとも劣らない身のこなしで木から木へと飛び移る　木登りの達人。,×,×,×,○,○,○,×,×,○,93,101,98,81,82,75,90,194,191,188,172,171,163,708
2602,日高 岳,日高,男,風,MF,選手,中学生,三年生,白恋中,超危険な　冬山登山のエキスパート。タフな体と冷静な判断力を併せ持っている。,×,×,×,○,○,○,×,×,○,90,104,105,77,75,75,93,194,197,198,168,170,152,679
2603,石 岩次郎,グリズリー,男,火,FW,選手,中学生,三年生,白恋中,相手の選手に　ケガを負わせることで喜びを感じるという　キケンなぶっ壊し屋。,×,×,×,○,○,○,×,×,○,114,108,98,81,78,78,86,222,194,184,164,167,159,708
2604,熊崎 伝治,熊崎,男,山,MF,監督,大人,-,白恋中,白恋中サッカー部監督。細かい戦略よりも　力押しの采配が得意。,×,×,×,○,○,○,×,×,○,93,101,98,81,82,75,90,194,191,188,172,171,163,708
2605,硬山 強,硬山,男,山,GK,選手,中学生,三年生,木戸川清修中/革命選抜チーム,非常に気の強そうな顔をしているが見かけによらず　かなり穏やかな性格。,×,×,×,○,○,○,×,×,○,79,86,81,91,95,98,86,165,172,167,181,177,186,859
2606,大磯川 太郎,おおいそ,男,林,DF,選手,中学生,二年生,木戸川清修中,ボート競技　レガッタの練習をしている。そのため　上半身はずいぶんと鍛えられた。,×,×,×,○,○,○,×,×,○,79,83,84,91,95,81,104,162,187,188,199,195,186,791
2607,石川 神兵,石川,男,林,DF,選手,中学生,二年生,木戸川清修中,ある偉人の末裔だというが本人はその事について語ろうとはしない。,×,×,×,○,○,○,×,×,○,79,83,84,91,95,81,104,162,187,188,199,195,186,791
2608,山裂 虎太郎,山裂,男,火,DF,選手,中学生,一年生,木戸川清修中,フィールドを　ちょこまかと動きまわり相手をかく乱するようなスタイルが得意。,×,×,×,○,○,○,×,×,○,76,79,77,95,99,81,110,155,189,187,209,205,194,811
2609,湖沼 枠,湖沼,男,林,DF,選手,中学生,一年生,木戸川清修中,公園にある大きな湖や　池の周囲をぐるりと回ってランニングするのが好き。,×,×,×,○,○,○,×,×,○,79,83,84,91,95,81,104,162,187,188,199,195,186,791
2610,清水 柳人,清水,男,風,MF,選手,中学生,二年生,木戸川清修中/革命選抜チーム,放課後はストリートミュージシャンとして駅前などで　ギターの弾き語りをしている。,×,×,×,○,○,○,×,×,○,93,101,98,81,82,75,90,194,191,188,172,171,163,708
2611,和泉 奏秋,和泉,男,風,MF,選手,中学生,二年生,木戸川清修中,能楽界のお坊ちゃんで　サッカーはあくまで　たしなみの一つに過ぎない。,×,×,×,○,○,○,×,×,○,90,104,105,77,75,75,93,194,197,198,168,170,152,679
2612,跳沢 真波,跳沢,男,火,MF,選手,中学生,二年生,木戸川清修中,短気な性格で　些細な事でもすぐにヒートアップしてしまうクセがある。,×,×,×,○,○,○,×,×,○,90,104,105,77,75,75,93,194,197,198,168,170,152,679
2613,貴志部 大河,貴志部,男,山,MF,選手,中学生,二年生,木戸川清修中/革命選抜チーム/レジスタンスジャパン,プロも注目しているスタープレイヤー。練習の虫で　常に努力を怠らない。,×,×,×,○,○,○,×,×,○,97,104,102,84,85,78,93,201,197,195,178,177,169,735
2614,滝 総介,総介,男,山,FW,選手,中学生,二年生,木戸川清修中/革命選抜チーム,快彦の兄。自信家のため他を見下しスタンドプレイを取ることも。,×,×,×,○,○,○,×,×,○,114,108,98,81,78,78,86,222,194,184,164,167,159,708
2615,河宮 幸多,河宮,男,火,FW,選手,中学生,一年生,木戸川清修中,日本古代の神話や　伝承にハマっていて神社や遺跡に　片っ端から訪れている。,×,×,×,○,○,○,×,×,○,104,101,91,81,78,75,90,205,191,181,168,171,159,696
2616,鬼怒川 我貫,鬼怒川,男,火,GK,選手,中学生,三年生,木戸川清修中,温泉巡りが彼にとってのライフワーク。疲れもケガも　湯治で完全回復する体質。,×,×,×,○,○,○,×,×,○,79,86,81,88,95,101,86,165,172,167,181,174,183,865
2617,滝 快彦,快彦,男,山,FW,選手,中学生,一年生,木戸川清修中/革命選抜チーム,兄である総介に　憧れていると同時に実力差のコンプレックスも　抱いている。,×,×,×,○,○,○,×,×,○,104,101,91,81,78,75,90,205,191,181,168,171,159,696
2618,遊海 瑞,遊海,男,風,FW,選手,中学生,二年生,木戸川清修中,将来は　プロのサッカー選手になって実家の生計を助けたいと考える孝行者。,×,×,×,○,○,○,×,×,○,104,101,91,81,78,75,90,205,191,181,168,171,159,696
2619,五色 潤,五色,男,山,DF,選手,中学生,一年生,木戸川清修中,荒れ果てた湖や川の失われた自然を再生させる方法について研究している。,×,×,×,○,○,○,×,×,○,79,83,84,91,95,81,104,162,187,188,199,195,186,791
2620,川内 広明,川内,男,林,MF,選手,中学生,一年生,木戸川清修中,アユやヤマメといった川魚が好きでヒマを見つけては　川へ釣りに出かける。,×,×,×,○,○,○,×,×,○,93,101,98,81,82,75,90,194,191,188,172,171,163,708
2621,亜風炉 照美,アフロディ,男,林,MF,監督,大人,-,木戸川清修中,元世宇子キャプテンで木戸川清修の監督。その美しい采配に　敵までもウットリ。,×,×,×,○,○,○,×,×,○,104,112,109,91,92,85,100,216,212,209,192,191,183,798
2622,箱野 随一,箱野,男,山,GK,選手,中学生,三年生,幻影学園,巨体に似合わず　反射神経がバツグンでＰＫ戦ではその実力を大いに発揮する。,×,×,×,○,○,○,×,×,○,79,86,81,88,95,101,86,165,172,167,181,174,183,865
2623,暮内 逢馬,暮内,男,林,DF,選手,中学生,二年生,幻影学園,千人規模で　かくれんぼができるほどの広大な竹林を所有する　大地主の息子。,×,×,×,○,○,○,×,×,○,79,83,84,91,95,81,104,162,187,188,199,195,186,791
2624,小津野 役,小津野,男,火,DF,選手,中学生,一年生,幻影学園,己の技と力を磨くため　丸１年もの間単身　山ごもり修行をしたという強者。,×,×,×,○,○,○,×,×,○,79,83,84,91,95,81,104,162,187,188,199,195,186,791
2625,道家 冠十郎,道家,男,山,DF,選手,中学生,三年生,幻影学園,由緒正しき　日本舞踊家の末裔。厳格な家庭で育ったため　俗世に疎い。,×,×,×,○,○,○,×,×,○,79,83,84,91,95,81,104,162,187,188,199,195,186,791
2626,新木 朗,新木,男,山,DF,選手,中学生,二年生,幻影学園,トリックアートを描くのが趣味で自分の作品を展示する　展覧会を計画中。,×,×,×,○,○,○,×,×,○,79,83,84,91,95,81,104,162,187,188,199,195,186,791
2627,銅原 帝人,銅原,男,風,MF,選手,中学生,一年生,幻影学園,占星術を駆使した先読みが得意だが試合の展開を占うのは　苦手なようだ。,×,×,×,○,○,○,×,×,○,90,104,105,77,75,75,93,194,197,198,168,170,152,679
2628,札野 霧正,札野,男,風,MF,選手,中学生,二年生,幻影学園,普段は　あまり積極的に動かないがいざという時　頼りになるチームの切り札。,×,×,×,○,○,○,×,×,○,90,104,105,77,75,75,93,194,197,198,168,170,152,679
2629,小鳩 宏夫,小鳩,男,林,MF,選手,中学生,一年生,幻影学園,一般人には見えないものが見えるらしいが嘘か真か　誰もそれを確かめられない…。,×,×,×,○,○,○,×,×,○,90,104,105,77,75,75,93,194,197,198,168,170,152,679
2630,真帆路 正,真帆路,男,林,MF,選手,中学生,三年生,幻影学園/レジスタンスジャパン,笑わないストライカーとして有名な選手。奇策や　相手のウラをかくプレイが得意。,×,×,×,○,○,○,×,×,○,97,104,102,84,85,78,93,201,197,195,178,177,169,735
2631,不知火 幻一,幻一,男,火,FW,選手,中学生,二年生,幻影学園,相手を翻弄する不知火兄弟の兄。影二との連携プレイで　前線を突破する。,×,×,×,○,○,○,×,×,○,110,104,95,77,75,75,83,214,187,178,158,160,152,679
2632,不知火 影二,影二,男,林,FW,選手,中学生,一年生,幻影学園,身軽でトリッキーな不知火兄弟の弟。幻一との完璧なコンビネーションが武器。,×,×,×,○,○,○,×,×,○,110,104,95,77,75,75,83,214,187,178,158,160,152,679
2633,虚木 実美,虚木,男,風,GK,選手,中学生,一年生,幻影学園,ウソの中に本当の部分を巧みに織り交ぜるハッタリ名人。,×,×,×,○,○,○,×,×,○,79,86,81,88,95,101,86,165,172,167,181,174,183,865
2634,井柳 丈次,井柳,男,山,DF,選手,中学生,二年生,幻影学園,手品を披露し　周囲を驚かせるのが趣味でプロのマジシャンになる日を夢見ている。,×,×,×,○,○,○,×,×,○,79,83,84,91,95,81,104,162,187,188,199,195,186,791
2635,真地 椎矢,真地,男,山,MF,選手,中学生,二年生,幻影学園,目つきのせいか人相が悪く見えるが実は品行方正で実直なナイスガイ。,×,×,×,○,○,○,×,×,○,93,101,98,81,82,75,90,194,191,188,172,171,163,708
2636,取行 麻也,取行,男,風,FW,選手,中学生,一年生,幻影学園,トランプを使った対戦ゲームが好きで空き時間があれば　対戦相手を探している。,×,×,×,○,○,○,×,×,○,110,104,95,77,75,75,83,214,187,178,158,160,152,679
2637,大木 玉則,大木,男,火,FW,選手,中学生,三年生,幻影学園,図体に似合わず　玉乗り曲芸がうまい。隠し芸として披露したら妙にウケた。,×,×,×,○,○,○,×,×,○,104,101,91,81,78,75,90,205,191,181,168,171,159,696
2638,宝水院 忠則,宝水院,男,山,DF,監督,大人,-,幻影学園,幻影学園サッカー部監督。捉えどころの無い采配で　瞬く間に勝利をさらう。,×,×,×,○,○,○,×,×,○,76,79,77,95,99,81,110,155,189,187,209,205,194,811
2639,佐田 土佐丸,佐田,男,山,GK,選手,中学生,二年生,新雲学園,持ち前の大きな声で自陣のゴールから味方を激励して　チームの士気を高める。,×,×,×,○,○,○,×,×,○,86,94,88,95,102,107,93,180,187,181,195,188,197,924
2640,浦野 天正,浦野,男,林,DF,選手,中学生,一年生,新雲学園,視野が広く　背後の敵にも反応できるので背中にも目があるかのようだと称される。,×,×,×,○,○,○,×,×,○,79,83,84,91,95,81,104,162,187,188,199,195,186,791
2641,武雲 月弥,武雲,男,林,DF,選手,中学生,三年生,新雲学園,空を見ただけで　その日の夜間の天候と月が出る位置を言い当てる事ができる。,×,×,×,○,○,○,×,×,○,79,83,84,91,95,81,104,162,187,188,199,195,186,791
2642,安守 地春,安守,男,山,DF,選手,中学生,一年生,新雲学園,任侠映画に影響されたせいで　口が悪いがプレイスタイルは　いたってクリーンだ。,×,×,×,○,○,○,×,×,○,79,83,84,91,95,81,104,162,187,188,199,195,186,791
2643,牧里 水樹,牧里,男,風,DF,選手,中学生,二年生,新雲学園,彼が得意とする　スムーズな連続プレイはさながら　小川を静かに流れる水のようだ。,×,×,×,○,○,○,×,×,○,79,83,84,91,95,81,104,162,187,188,199,195,186,791
2644,古戸 冥次,古戸,男,火,MF,選手,中学生,一年生,新雲学園,いろんな小道具を作る　自称『発明家』。ただし　他人のための発明はしない主義。,×,×,×,○,○,○,×,×,○,93,101,98,81,82,75,90,194,191,188,172,171,163,708
2645,雛乃 金輔,雛乃,男,林,MF,選手,中学生,二年生,新雲学園,見る者を惹きつける美しいプレイが特徴で時には　自身に酔いしれることさえある。,×,×,×,○,○,○,×,×,○,97,104,102,84,85,78,93,201,197,195,178,177,169,735
2646,樹田 木蓮,樹田,男,山,MF,選手,中学生,二年生,新雲学園,新雲学園のカリスマアロマセラピスト。香りを嗅ぐだけで　種類や効能を判別する。,×,×,×,○,○,○,×,×,○,90,104,105,77,75,75,93,194,197,198,168,170,152,679
2647,真住 火朗志,真住,男,火,MF,選手,中学生,一年生,新雲学園,他人に対してぶっきらぼうな態度を取るが本当は義理堅く情に厚い　とても良いヤツ。,×,×,×,○,○,○,×,×,○,90,104,105,77,75,75,93,194,197,198,168,170,152,679
2648,雨宮 太陽,雨宮,男,火,FW,選手,中学生,一年生,新雲学園/クロノストーム,１０年に１人の逸材との呼び声も高いまさに天才肌のサッカー選手。,×,×,×,○,○,○,×,×,○,121,115,105,88,85,85,93,236,208,198,178,181,173,771
2649,根淵 海友,根淵,男,風,FW,選手,中学生,二年生,新雲学園,長い足をムチのようにしならせることで細身の身体ながら　強力なシュートを放つ。,×,×,×,○,○,○,×,×,○,114,108,98,81,78,78,86,222,194,184,164,167,159,708
2650,瀬嶺 数豊,瀬嶺,男,林,GK,選手,中学生,一年生,新雲学園,ノートの余白にラクガキをするときはなぜか　いつもジグザグ模様を描いている。,×,×,×,○,○,○,×,×,○,79,86,81,88,95,101,86,165,172,167,181,174,183,865
2651,茅原 恵智,茅原,男,山,FW,選手,中学生,一年生,新雲学園,どうでもいい知識が豊富な雑学マニア。残念ながら役に立ったことは一度もない。,×,×,×,○,○,○,×,×,○,104,101,91,81,78,75,90,205,191,181,168,171,159,696
2652,伊里 虹七郎,伊里,男,林,MF,選手,中学生,一年生,新雲学園,虹を見るのが生きがいで　雨が上がると自転車に乗って　家の外に飛び出していく。,×,×,×,○,○,○,×,×,○,93,101,98,81,82,75,90,194,191,188,172,171,163,708
2653,比嘉 健康,比嘉,男,風,DF,選手,中学生,三年生,新雲学園,カゼも引いたことのない丈夫な身体が自慢。バカはカゼを引かない　という言葉が嫌い。,×,×,×,○,○,○,×,×,○,79,83,84,91,95,81,104,162,187,188,199,195,186,791
2654,上須田 四郎,上須田,男,山,DF,選手,中学生,三年生,新雲学園,昔ながらの　かまどを使った料理が得意。火加減が絶妙だと　もっぱらの評判だとか。,×,×,×,○,○,○,×,×,○,79,83,84,91,95,81,104,162,187,188,199,195,186,791
2655,狩部 蘭子,狩部,女,火,GK,監督,大人,-,新雲学園,新雲学園サッカー部監督。理想的な采配で　チームを勝利に導く。,×,×,×,○,○,○,×,×,○,79,86,81,91,95,98,86,165,172,167,181,177,186,859
2656,征木 帝矢,征木,男,山,GK,選手,中学生,一年生,聖堂山中,ゴールは神聖な空間であると考えておりそれを汚そうとする者には　容赦をしない。,×,×,×,○,○,○,×,×,○,79,86,81,88,95,101,86,165,172,167,181,174,183,865
2657,宗森 秀年,宗森,男,風,DF,選手,中学生,三年生,聖堂山中,サッカーの神に自身のすべてを捧げるべく非常に献身的なプレイで　チームを支える。,×,×,×,○,○,○,×,×,○,76,79,77,95,99,81,110,155,189,187,209,205,194,811
2658,呉井 雄大,呉井,男,山,DF,選手,中学生,三年生,聖堂山中,体重を利用した　重たいキックを得意としその足さばきは　まるで大剣だと称される。,×,×,×,○,○,○,×,×,○,76,79,77,95,99,81,110,155,189,187,209,205,194,811
2659,伊矢部 敏志,伊矢部,男,林,DF,選手,中学生,二年生,聖堂山中,どんな状況であれ　ボールを見失わずに的確なディフェンスをする　安定感が特徴。,×,×,×,○,○,○,×,×,○,79,83,84,91,95,81,104,162,187,188,199,195,186,791
2660,穂積 信平,穂積,男,山,DF,選手,中学生,二年生,聖堂山中,持ち前の豊富な運動量でフィールド中を縦横無尽に駆け回るタフネスプレイヤー。,×,×,×,○,○,○,×,×,○,79,83,84,91,95,81,104,162,187,188,199,195,186,791
2661,天瀬 玲亜,天瀬,男,火,MF,選手,中学生,一年生,聖堂山中,中学生でありながら　達観した思考を持ちどんなことがあっても　決して動じない。,×,×,×,○,○,○,×,×,○,90,104,105,77,75,75,93,194,197,198,168,170,152,679
2662,日向 理恩,日向,男,火,MF,選手,中学生,一年生,聖堂山中,絶好調なときの彼のプレイは神がかり的で夏空のように眩しく輝いて見えるという。,×,×,×,○,○,○,×,×,○,93,101,98,81,82,75,90,194,191,188,172,171,163,708
2663,黒裂 真命,黒裂,男,火,MF,選手,中学生,二年生,聖堂山中/レジスタンスジャパン,心技体　すべてが完璧なサッカー選手。自他共に認める　サッカーの神の申し子だ。,×,×,×,○,○,○,×,×,○,97,104,102,84,85,78,93,201,197,195,178,177,169,735
2664,桶川 之守,桶川,男,火,MF,選手,中学生,一年生,聖堂山中,小さな身体からは　想像もつかないほどの激しいプレイで　相手の選手を圧倒する。,×,×,×,○,○,○,×,×,○,93,101,98,81,82,75,90,194,191,188,172,171,163,708
2665,恋崎 伊雄,恋崎,男,風,FW,選手,中学生,二年生,聖堂山中,幼少の頃から　サッカーのエリートとして英才教育を受けてきたという　スター選手。,×,×,×,○,○,○,×,×,○,110,104,95,77,75,75,83,214,187,178,158,160,152,679
2666,堤美 智,堤美,男,火,FW,選手,中学生,二年生,聖堂山中,華麗なプレイと爽やかなルックスのためファンクラブが発足するほどの人気選手。,×,×,×,○,○,○,×,×,○,110,104,95,77,75,75,83,214,187,178,158,160,152,679
2667,手水 研二,手水,男,風,GK,選手,中学生,一年生,聖堂山中,ピッチに立つ前には　独自のゲン担ぎで必ず　手足を水で清めるという習慣を持つ。,×,×,×,○,○,○,×,×,○,79,86,81,88,95,101,86,165,172,167,181,174,183,865
2668,府老 明貞,府老,男,山,DF,選手,中学生,一年生,聖堂山中,何年も前から　まったく外見が変化せず実年齢よりも幼く見られるのが　彼の悩み。,×,×,×,○,○,○,×,×,○,76,79,77,95,99,81,110,155,189,187,209,205,194,811
2669,有野 緒美,有野,男,林,MF,選手,中学生,二年生,聖堂山中,フリーキックの軌道を美しく見せる事になぜか　やけに強いこだわりを持っている。,×,×,×,○,○,○,×,×,○,93,101,98,81,82,75,90,194,191,188,172,171,163,708
2670,阿藤 嵐,阿藤,男,山,FW,選手,中学生,三年生,聖堂山中,元々はキックボクシングの選手だったため強じんな足腰と俊敏さを兼ね備えている。,×,×,×,○,○,○,×,×,○,104,101,91,81,78,75,90,205,191,181,168,171,159,696
2671,麻生 暮人,麻生,男,風,MF,選手,中学生,一年生,聖堂山中,夜明け前から日が暮れるまで　ぶっ通しで練習を続けるという　超ハードトレーニー。,×,×,×,○,○,○,×,×,○,93,101,98,81,82,75,90,194,191,188,172,171,163,708
2672,イシド シュウジ,イシド,男,火,FW,監督,大人,-,聖堂山中,フィフスセクター聖帝。サッカーを支配しようとしているが　その真意は…？,×,×,×,○,○,○,×,×,○,110,104,95,77,75,75,83,214,187,178,158,160,152,679
2673,砂木沼 治,砂木沼,男,火,MF,コーチ,大人,-,聖堂山中,相手が強敵であるほど気持ちが高ぶる。サッカーへの熱い想いが止まらない。,×,×,×,○,○,○,×,×,○,100,108,105,88,88,81,97,208,205,202,185,185,176,764
2674,千宮路 大和,千宮路,男,火,GK,選手,中学生,二年生,ドラゴンリンク/レジスタンスジャパン,千宮路大悟を父に持つ　ゴールキーパー。強大なカリスマ性で　チームを掌握する。,×,×,×,○,○,○,×,×,○,86,94,88,95,102,107,93,180,187,181,195,188,197,924
2675,護巻 徹郎,護巻,男,風,DF,選手,中学生,二年生,ドラゴンリンク/レジスタンスジャパン,恵まれた体格と　賢さをあわせ持つ守備のスペシャリスト。,×,×,×,○,○,○,×,×,○,79,83,84,91,95,81,104,162,187,188,199,195,186,791
2676,郷石 閃真,郷石,男,風,DF,選手,中学生,一年生,ドラゴンリンク,頭突きなら誰にも負けないという石頭でヘディングでの競り合いはガンガン攻める。,×,×,×,○,○,○,×,×,○,79,83,84,91,95,81,104,162,187,188,199,195,186,791
2677,五味 清栄,五味,男,山,MF,選手,中学生,二年生,ドラゴンリンク,勢いと思い切りの良いプレイが持ち味だが我が強く　言動もプレイもかなり荒っぽい。,×,×,×,○,○,○,×,×,○,93,101,98,81,82,75,90,194,191,188,172,171,163,708
2678,神山 豪之伸,神山,男,林,MF,選手,中学生,一年生,ドラゴンリンク,大和と共に守備を統率する　陰の大黒柱。無理な判断はせず　危険を冒さないタイプ。,×,×,×,○,○,○,×,×,○,97,104,102,84,85,78,93,201,197,195,178,177,169,735
2679,猪狩 強利貴,猪狩,男,火,MF,選手,中学生,三年生,ドラゴンリンク,感情が高ぶりやすく　些細なキッカケですぐにヒートアップしてしまう。,×,×,×,○,○,○,×,×,○,97,104,102,84,85,78,93,201,197,195,178,177,169,735
2680,聖城 将護,聖城,男,火,FW,選手,中学生,一年生,ドラゴンリンク,自身に逆らう者は　すべて邪悪とみなしサッカーを用いて相手を浄化しようとする。,×,×,×,○,○,○,×,×,○,114,108,98,81,78,78,86,222,194,184,164,167,159,708
2681,御戸 翔,御戸,男,山,FW,選手,中学生,二年生,ドラゴンリンク,相手のプレイの　一瞬の綻びをも見逃さず突破口を開き　常に攻撃の起点となる選手。,×,×,×,○,○,○,×,×,○,114,108,98,81,78,78,86,222,194,184,164,167,159,708
