No,Name,NickName,GENDER,ELEMENT,POSITION,ROLE,AGE_GROUP,SCHOOL_YEAR,TEAM,OBTAIN,IE1,IE2,IE3,GO1,GO2,GO3,ARS,ORI,VIC,KICK,CONTROL,TECHNIQUE,PRESSURE,PHYSICAL,AGILITY,INTELLIGENCE,SHOT,FOCUS(AT),FOCUS(DF),SCRAMBLE(AT),SCRAMBLE(DF),SHOT_BLOCK,KEEPER_POWER
3786,タラモ・タラワ,タラモ,女,風,DF,選手,中学生,一年生,無所属,何にでも大量の唐辛子をかけ激辛にする辛いものが大好きな南国スパイシーガール。,×,×,×,×,○,○,×,×,○,76,79,77,95,99,81,110,155,189,187,209,205,194,811
3787,仲見世 茶代,茶代,女,風,DF,選手,中学生,二年生,無所属,自宅のお茶屋さんを手伝っている看板娘。彼女に会うために通い詰める客もいるとか。,×,×,×,×,○,○,×,×,○,79,83,84,91,95,81,104,162,187,188,199,195,186,791
3788,仏野 粉乃,ふつうのこ,女,山,DF,選手,中学生,二年生,無所属,他人からは　普通だとよく言われているが実は　他人には言えない趣味を持っている。,×,×,×,×,○,○,×,×,○,79,83,84,91,95,81,104,162,187,188,199,195,186,791
3789,太布里 杏,たっぷり,女,山,DF,選手,中学生,一年生,無所属,大好物の餅を　髪の中に詰めて持ち歩いてはお腹が空いたときに取り出し　食べるという。,×,×,×,×,○,○,×,×,○,76,79,77,95,99,81,110,155,189,187,209,205,194,811
3790,古俵 木ノ実,木ノ実,女,火,MF,選手,中学生,二年生,無所属,こだわりのクシで　どんな髪型も自由自在。今日もバッチリと　ヘアスタイルをキメる。,×,×,×,×,○,○,×,×,○,93,101,98,81,82,75,90,194,191,188,172,171,163,708
3791,笹呉 華芽,華芽,女,林,GK,選手,中学生,二年生,無所属,木の芽や花のつぼみを観察するのが大好き。花が咲きそうなつぼみを一日中観察する。,×,×,×,×,○,○,×,×,○,79,86,81,88,95,101,86,165,172,167,181,174,183,865
3792,本喜 真市,ほんき,男,風,FW,選手,中学生,二年生,無所属,何事にも本気で取り組む一直線なヤツ。一度に一つのことしかできないのが玉に瑕。,×,×,×,×,○,○,×,×,○,110,104,95,77,75,75,83,214,187,178,158,160,152,679
3793,遠国 伝ノ輔,デンスケ,男,山,FW,選手,中学生,一年生,無所属,腹の底から声を出すと　隣の村まで届く。ただし　お腹が空いているとダメらしい。,×,×,×,×,○,○,×,×,○,110,104,95,77,75,75,83,214,187,178,158,160,152,679
3794,塙 主守留,主守留,男,林,FW,選手,中学生,一年生,無所属,一年中　ひどい花粉症に悩まされておりズルズルと鼻をすすってしまうクセがある。,×,×,×,×,○,○,×,×,○,104,101,91,81,78,75,90,205,191,181,168,171,159,696
3795,堀鱈 寿亭無,ほれたら,男,火,GK,選手,中学生,二年生,無所属,外国人の女の子との恋を夢見ており様々な言語で　愛の言葉を勉強している。,×,×,×,×,○,○,×,×,○,79,86,81,88,95,101,86,165,172,167,181,174,183,865
3796,刃槍 蒼多,刃槍,男,火,MF,選手,中学生,二年生,無所属,自分が　流行を生み出していると豪語するブームに敏感な　流行モノ大好き少年。,×,×,×,×,○,○,×,×,○,93,101,98,81,82,75,90,194,191,188,172,171,163,708
3797,六道 衣紋丞,衣紋丞,男,林,FW,選手,中学生,三年生,無所属,顔に似合わず　個性的な着物が好きで最新の反物などは　欠かさずチェックする。,×,×,×,×,○,○,×,×,○,110,104,95,77,75,75,83,214,187,178,158,160,152,679
3798,阿仁 吉方次,あにき,男,風,GK,選手,中学生,三年生,無所属,見ず知らずの人にも　アニキと呼ばれる。妙な頼りがいがある　僕らのアニキだ。,×,×,×,×,○,○,×,×,○,79,86,81,88,95,101,86,165,172,167,181,174,183,865
3799,葦河 迅兵,あしかわ,男,火,DF,選手,中学生,三年生,無所属,足が速いので　よく頼みごとをされる。今日も　ひとっ走りしてきたところだ。,×,×,×,×,○,○,×,×,○,79,83,84,91,95,81,104,162,187,188,199,195,186,791
3800,楠里 歌万呂,楠里,男,山,FW,選手,中学生,二年生,無所属,那古屋城の城下町で　歌をうたいながら病気の人のために　薬を売り歩いている。,×,×,×,×,○,○,×,×,○,110,104,95,77,75,75,83,214,187,178,158,160,152,679
3801,根深 韮実,にらみ,男,風,FW,選手,中学生,二年生,無所属,鋭い目つきで　相手に睨みをきかせる。睨むだけ睨み　決して手を出そうとしない。,×,×,×,×,○,○,×,×,○,110,104,95,77,75,75,83,214,187,178,158,160,152,679
3802,タント・タべリーヨ,コック,男,火,MF,選手,中学生,三年生,無所属,大量に作りすぎて　余ってしまった料理はすべて自分でたいらげる　見習いコック。,×,×,×,×,○,○,×,×,○,90,104,105,77,75,75,93,194,197,198,168,170,152,679
3803,アダム・センセージュ,せんせい,男,風,GK,選手,中学生,三年生,無所属,占星術で未来を見通すスペシャリスト。試合の行方を知るのもたやすいという。,×,×,×,×,○,○,×,×,○,79,86,81,88,95,101,86,165,172,167,181,174,183,865
3804,カンナ・モッテルモン,ちょうこく,女,林,DF,選手,中学生,二年生,無所属,超一流の彫刻家を目指している彼女は寝る時でも　カンナとノミを手放さない。,×,×,×,×,○,○,×,×,○,79,83,84,91,95,81,104,162,187,188,199,195,186,791
3805,オードリー・コーエン,おどりこ,女,風,DF,選手,中学生,二年生,無所属,アラビア仕込みのダンスで　敵を魅了する。妖しい動きに誘われて戦意喪失してしまう。,×,×,×,×,○,○,×,×,○,79,83,84,91,95,81,104,162,187,188,199,195,186,791
3806,オルモローネ・イッシ,どうけ,男,林,FW,選手,中学生,二年生,無所属,他人を笑わせることに生きがいを感じるがおもしろくないと言われると　体調を崩す。,×,×,×,×,○,○,×,×,○,110,104,95,77,75,75,83,214,187,178,158,160,152,679
3807,ヴォルフガング,ウルフ,男,風,FW,選手,中学生,二年生,無所属,オオカミのように　荒々しいプレイが特徴。チームの中にいても　孤高の存在感を放つ。,×,×,×,×,○,○,×,×,○,110,104,95,77,75,75,83,214,187,178,158,160,152,679
3808,ハドリアヌス,ドリアン,男,林,GK,選手,中学生,三年生,無所属,地元では知らない者はいない暴れん坊。どこの誰に対しても　偉そうに振る舞う。,×,×,×,×,○,○,×,×,○,79,86,81,91,95,98,86,165,172,167,181,177,186,859
3809,トリヨンフ,トリュフ,男,山,MF,選手,中学生,二年生,無所属,市場には　ほとんど出回らないという世にも珍しいキノコを見つける名人。,×,×,×,×,○,○,×,×,○,93,101,98,81,82,75,90,194,191,188,172,171,163,708
3810,ノルマンド,ノマド,男,林,FW,選手,中学生,三年生,無所属,指名手配犯を捕まえては　賞金稼ぎをして日々暮らしている　バウンティハンター。,×,×,×,×,○,○,×,×,○,110,104,95,77,75,75,83,214,187,178,158,160,152,679
3811,ミーア・キャット,ミーア,女,山,FW,選手,中学生,一年生,無所属,８人もの弟妹を持つ　しっかり者の長女。友達にも　母親のようだとよく言われる。,×,×,×,×,○,○,×,×,○,110,104,95,77,75,75,83,214,187,178,158,160,152,679
3812,シモン・クルール,シモン,男,風,GK,選手,中学生,二年生,無所属,『生真面目』を絵に描いたような人物。廊下を直角に曲がってしまうクセがある。,×,×,×,×,○,○,×,×,○,79,86,81,88,95,101,86,165,172,167,181,174,183,865
3813,セルジュ・ノワール,セルジュ,男,林,FW,選手,中学生,二年生,無所属,世渡り上手で　楽しいことだけしたがる。そのためならなんでも利用するズルいヤツ。,×,×,×,×,○,○,×,×,○,110,104,95,77,75,75,83,214,187,178,158,160,152,679
3814,フランツ・ヴィオレ,フランツ,男,山,FW,選手,中学生,一年生,無所属,なぜだか　小鳥たちに好かれる体質らしくふと気がつくと　肩に小鳥が止まっている。,×,×,×,×,○,○,×,×,○,110,104,95,77,75,75,83,214,187,178,158,160,152,679
3815,ダミアン・ルージュ,ダミアン,男,山,MF,選手,中学生,二年生,無所属,３人の　歳の離れた姉に囲まれて育ったためこの歳にして　かなりの世渡り上手。,×,×,×,×,○,○,×,×,○,93,101,98,81,82,75,90,194,191,188,172,171,163,708
3816,アンドレ・ブラン,アンドレ,男,火,MF,選手,中学生,一年生,無所属,何事においても１番でないと気が済まない。負けず嫌いの度合いでは　恐らく世界一。,×,×,×,×,○,○,×,×,○,93,101,98,81,82,75,90,194,191,188,172,171,163,708
3817,夏 元惇,カコウトン,男,風,FW,選手,中学生,三年生,無所属,黒き眼帯の奥に秘密を隠したワイルドガイ。その左眼には　ものもらいがうずいている。,×,×,×,×,○,○,×,×,○,110,104,95,77,75,75,83,214,187,178,158,160,152,679
3818,典 角韋,テンイ,男,山,GK,選手,中学生,三年生,無所属,何よりも飲茶が大好きな大食い。餃子や小龍包を　口の中に放り込んでいく。,×,×,×,×,○,○,×,×,○,79,86,81,91,95,98,86,165,172,167,181,177,186,859
3819,許 虎猪,キョコチョ,男,山,FW,選手,中学生,三年生,無所属,身体はデカいが　肝はちっちゃい。美人の前では　真っ赤になってしまう。,×,×,×,×,○,○,×,×,○,110,104,95,77,75,75,83,214,187,178,158,160,152,679
3820,遼 張遠,チョウリ,男,山,FW,選手,中学生,三年生,無所属,いつも他人から恨みを買っているため東屋での昼寝だけが心安らぐ時間だとか。,×,×,×,×,○,○,×,×,○,110,104,95,77,75,75,83,214,187,178,158,160,152,679
3821,楽 進謙,ガクシン,男,林,FW,選手,中学生,三年生,無所属,弓矢のトレーニングに余念がない。自宅の庭にマトを並べ　練習場まで作った。,×,×,×,×,○,○,×,×,○,110,104,95,77,75,75,83,214,187,178,158,160,152,679
3822,小 喬姫,ショウキ,女,林,GK,選手,中学生,二年生,無所属,フローラルの香りを振りまいているとちまたで噂になっている　絶世の美女。,×,×,×,×,○,○,×,×,○,79,86,81,88,95,101,86,165,172,167,181,174,183,865
3823,趙 龍雲,チョウウン,男,山,FW,選手,中学生,二年生,無所属,イケメンな上に　勉強もスポーツも超一流。しかし　昆虫だけは苦手なようだ…。,×,×,×,×,○,○,×,×,○,110,104,95,77,75,75,83,214,187,178,158,160,152,679
3824,馬 超孟,バチョウ,男,火,MF,選手,中学生,三年生,無所属,ちょっとケンカっ早い性格なのが難点だがそのぶん仲直りも早いので何とかなる。,×,×,×,×,○,○,×,×,○,93,101,98,81,82,75,90,194,191,188,172,171,163,708
3825,黄 漢忠,コウチュウ,男,山,MF,選手,中学生,三年生,無所属,つけヒゲで　貫禄を出そうとしてみたがどうやら　年寄りくさいと不評のようだ。,×,×,×,×,○,○,×,×,○,93,101,98,81,82,75,90,194,191,188,172,171,163,708
3826,姜 伯麒,キョウイ,男,林,FW,選手,中学生,一年生,無所属,イヤなことがあると　すぐに秘密基地に立て籠もってしまう　逃げ腰なヤツ。,×,×,×,×,○,○,×,×,○,110,104,95,77,75,75,83,214,187,178,158,160,152,679
3827,剛田 弐蔵,弐蔵,男,林,FW,選手,中学生,二年生,無所属,腕相撲大会で　日本一になったことがある。たぐいまれなる　豪腕の持ち主だ。,×,×,×,×,○,○,×,×,○,110,104,95,77,75,75,83,214,187,178,158,160,152,679
3828,寺田 涼,おりょう,女,風,GK,選手,中学生,二年生,無所属,ハスキーボイスのクールな美少女。女の子の隠れファンが　たくさんいる。,×,×,×,×,○,○,×,×,○,79,86,81,88,95,101,86,165,172,167,181,174,183,865
3829,小濱 千次郎,せんじろ,男,火,DF,選手,中学生,一年生,無所属,中学生にして　なかなかのオヤジ顔。父親と街を歩くと　兄弟だと思われる。,×,×,×,×,○,○,×,×,○,76,79,77,95,99,81,110,155,189,187,209,205,194,811
3830,高森 潜蔵,高森,男,林,FW,選手,中学生,三年生,無所属,他人には　偽りの名を名乗っているがかわいい女の子にだけ本名を明かすらしい。,×,×,×,×,○,○,×,×,○,110,104,95,77,75,75,83,214,187,178,158,160,152,679
3831,桂木 小十郎,かつら,男,山,FW,選手,中学生,一年生,無所属,頭でっかちで　バランスが悪いせいかいつもフラフラしており　すぐに転ぶ。,×,×,×,×,○,○,×,×,○,110,104,95,77,75,75,83,214,187,178,158,160,152,679
3832,弾目 閃九郎,せんくろ,男,林,FW,選手,中学生,二年生,無所属,面白半分で　試しに眼帯をつけてみたらカッコいいと褒めちぎられ　外せなくなった。,×,×,×,×,○,○,×,×,○,110,104,95,77,75,75,83,214,187,178,158,160,152,679
3833,石原海 紺兎,紺兎,男,山,FW,選手,中学生,三年生,無所属,石のように固い決意と海のように広い心で小柄だが　誰からも慕われるリーダーだ。,×,×,×,×,○,○,×,×,○,110,104,95,77,75,75,83,214,187,178,158,160,152,679
3834,新田 蜂之心,にっぱち,男,火,DF,選手,中学生,二年生,無所属,子どもの頃に　鼻をハチに刺されてからハチと　心を通わせられるようになった。,×,×,×,×,○,○,×,×,○,79,83,84,91,95,81,104,162,187,188,199,195,186,791
3835,丹勢谷 宗次,宗次,男,風,FW,選手,中学生,二年生,無所属,いつも完璧なスタイルを目指しているがすぐ顔がテカってしまうのが　一番の悩み。,×,×,×,×,○,○,×,×,○,110,104,95,77,75,75,83,214,187,178,158,160,152,679
3836,杵月 待路,杵月,男,風,GK,選手,中学生,三年生,無所属,杵と臼で餅をつくことに憧れているが腕力がなく　杵を振り上げられなかった。,×,×,×,×,○,○,×,×,○,79,86,81,88,95,101,86,165,172,167,181,174,183,865
3837,椎名 紅絹乃,シナモン,女,風,DF,選手,中学生,三年生,無所属,香りを嗅ぎ分けるのが得意。香辛料のお店を開くのが将来の夢だとか。,×,×,×,×,○,○,×,×,○,79,83,84,91,95,81,104,162,187,188,199,195,186,791
3838,黒部 ゆき,クローブ,女,火,MF,選手,中学生,一年生,無所属,小麦色に焼けた肌が自慢の　おてんば娘。夏になると　川へ飛び込んで魚を捕る。,×,×,×,×,○,○,×,×,○,93,101,98,81,82,75,90,194,191,188,172,171,163,708
3839,茶井 茉莉,チャイ,女,山,DF,選手,中学生,三年生,無所属,抹茶が大好きで　よく友達と茶会を開く。『わび・さび』や　作法を重んじる少女。,×,×,×,×,○,○,×,×,○,79,83,84,91,95,81,104,162,187,188,199,195,186,791
3840,久世 麻更,マサラ,女,山,FW,選手,中学生,二年生,無所属,他人には　綺麗な髪を羨ましがられるが本人は　天然パーマに憧れているらしい。,×,×,×,×,○,○,×,×,○,110,104,95,77,75,75,83,214,187,178,158,160,152,679
3841,多聞 花蓮,カルダモン,女,山,GK,選手,中学生,三年生,無所属,お寺の娘で　朝早くから庭掃除のお手伝い。こっそりと　境内に花を植えるのが楽しみ。,×,×,×,×,○,○,×,×,○,79,86,81,88,95,101,86,165,172,167,181,174,183,865
3842,ベリー・カーペンター,カンタベリ,女,風,DF,選手,中学生,一年生,無所属,寒がりで冬のあいだは家に閉じこもるため『冬眠のカンタベリ』と呼ばれている。,×,×,×,×,○,○,×,×,○,79,83,84,91,95,81,104,162,187,188,199,195,186,791
3843,マン・チェスター,マンチェス,男,火,GK,選手,中学生,二年生,無所属,サッカーの審判を務めてきた家系の息子で何事にも迷わず　するどい判断を下す。,×,×,×,×,○,○,×,×,○,79,86,81,91,95,98,86,165,172,167,181,177,186,859
3844,リック・ウォーリー,ウォリック,男,山,FW,選手,中学生,二年生,無所属,高い城壁のような　堅牢な守りを誇る。彼に狙われたら　牢に囚われたも同然だ。,×,×,×,×,○,○,×,×,○,110,104,95,77,75,75,83,214,187,178,158,160,152,679
3845,メイ・フェアリー,メイフェア,女,山,MF,選手,中学生,二年生,無所属,小柄だが　大勢のワルを陰で牛耳っている底知れない恐ろしさを持った華麗なるボス。,×,×,×,×,○,○,×,×,○,93,101,98,81,82,75,90,194,191,188,172,171,163,708
3846,エディ・バーランド,エディンバ,男,林,FW,選手,中学生,三年生,無所属,直情的で　真っ先に敵陣に突っ込んでいき綿密な作戦を台無しにする　自称エルフ。,×,×,×,×,○,○,×,×,○,110,104,95,77,75,75,83,214,187,178,158,160,152,679
3847,アーク・スコッチエッグ,アクス,男,林,FW,選手,中学生,二年生,無所属,頭の回転が非常に速く　どんな難題でもオノで一刀両断するかのごとく解決する。,×,×,×,×,○,○,×,×,○,110,104,95,77,75,75,83,214,187,178,158,160,152,679
3848,ハンス・マーマレード,ハンマード,男,火,DF,選手,中学生,一年生,無所属,ハンマーのような石頭で　どんな巨石をも叩き割ることができると　本人は豪語する。,×,×,×,×,○,○,×,×,○,76,79,77,95,99,81,110,155,189,187,209,205,194,811
3849,レイチェル・ピックルズ,レイピア,女,風,GK,選手,中学生,一年生,無所属,他人のボケに対する　彼女のツッコミは剣の切っ先のように　鋭い切れ味を誇る。,×,×,×,×,○,○,×,×,○,79,86,81,88,95,101,86,165,172,167,181,174,183,865
3850,ウィル・プディング,ウィップ,男,山,FW,選手,中学生,二年生,無所属,ヨークシャー・プディングが大好物で毎朝　出かける前に必ず食べていくという。,×,×,×,×,○,○,×,×,○,110,104,95,77,75,75,83,214,187,178,158,160,152,679
3851,アーネスト・チェリーパイ,アーチェリ,男,山,MF,選手,中学生,二年生,無所属,狩りに出かけるときは　早起きして焼いたチェリーパイを　仲間に振る舞っている。,×,×,×,×,○,○,×,×,○,90,104,105,77,75,75,93,194,197,198,168,170,152,679
3852,メアリ・ロビンソン,メアリ,女,山,DF,選手,中学生,三年生,無所属,友達や知人は　たくさんいるはずなのに彼女がどこに住んでいるのか　誰も知らない。,×,×,×,×,○,○,×,×,○,76,79,77,95,99,81,110,155,189,187,209,205,194,811
3853,ヘンジー・ストーンズ,ヘンジ,男,山,FW,選手,中学生,二年生,無所属,朽ちた遺跡を愛してやまない少年。家のベッドも　大きな石でできている。,×,×,×,×,○,○,×,×,○,110,104,95,77,75,75,83,214,187,178,158,160,152,679
3854,ホロウ・ウェイン,ホロウ,女,風,DF,選手,中学生,二年生,無所属,顔が怖いので　仮装していると誤解される。その実態は　甘いものに目がない普通の子。,×,×,×,×,○,○,×,×,○,79,83,84,91,95,81,104,162,187,188,199,195,186,791
3855,エリック・エンドルフィン,エルフ,男,林,GK,選手,中学生,三年生,無所属,森や野に生えているキノコのことならすべて熟知している　まさにキノコの妖精。,×,×,×,×,○,○,×,×,○,79,86,81,88,95,101,86,165,172,167,181,174,183,865
3856,マイク・バイキングス,バイク,男,火,DF,選手,中学生,三年生,無所属,とにかく　乗り物という乗り物が大好きで船でも車でもバイクでも上手に乗りこなす。,×,×,×,×,○,○,×,×,○,76,79,77,95,99,81,110,155,189,187,209,205,194,811
3857,ニール・カナイ,ニライ,男,風,FW,選手,中学生,三年生,無所属,『クシャミをすると魂が抜け出る』といううさんくさい言い伝えを　信じ込んでいる。,×,×,×,×,○,○,×,×,○,110,104,95,77,75,75,83,214,187,178,158,160,152,679
3858,リラ・サンク,サングリラ,女,火,GK,選手,中学生,二年生,無所属,花に囲まれて暮らす夢を実現するため緑化活動のボランティアに参加している。,×,×,×,×,○,○,×,×,○,79,86,81,88,95,101,86,165,172,167,181,174,183,865
3859,エル・シオン,エルシオン,男,山,FW,選手,中学生,二年生,無所属,一度会った人の顔と名前を絶対忘れない。…しかし　歴史上の人物は覚えられない。,×,×,×,×,○,○,×,×,○,110,104,95,77,75,75,83,214,187,178,158,160,152,679
3860,ライナ・ホウ,ホウライ,女,火,DF,選手,中学生,一年生,無所属,未来の『特殊樹木開発技術』を駆使してお菓子のなる木を　つくり上げるのが夢。,×,×,×,×,○,○,×,×,○,76,79,77,95,99,81,110,155,189,187,209,205,194,811
3861,アル・カティア,アルカディ,女,林,DF,選手,中学生,二年生,無所属,銀細工に凝っていて　とても細かいものも魔法のように　あっという間に作り上げる。,×,×,×,×,○,○,×,×,○,79,83,84,91,95,81,104,162,187,188,199,195,186,791
3862,照井 眠宮,テルミン,女,山,FW,選手,中学生,三年生,無所属,眠らずに遊び続ける方法を　日夜研究中。常に自分自身を実験台にしている。,×,×,×,×,○,○,×,×,○,104,101,91,81,78,75,90,205,191,181,168,171,159,696
3863,宝禄 礼無,ホログラム,男,風,GK,選手,中学生,二年生,無所属,お世話になった人に　律儀に贈り物をする。そのため出費の大半はプレゼント代だとか。,×,×,×,×,○,○,×,×,○,79,86,81,88,95,101,86,165,172,167,181,174,183,865
3864,加地 閲人,ガジェット,男,林,FW,選手,中学生,二年生,無所属,新しいガジェットは　速攻で手に入れる。使わなくても　見ているだけで幸せらしい。,×,×,×,×,○,○,×,×,○,110,104,95,77,75,75,83,214,187,178,158,160,152,679
3865,知留 逢斗,チルアウト,男,風,FW,選手,中学生,三年生,無所属,常にクールでいることに　こだわりを持ちアツくなりがちな人を　冷めた目で見ている。,×,×,×,×,○,○,×,×,○,110,104,95,77,75,75,83,214,187,178,158,160,152,679
3866,勒印 迷児,ログイン,男,火,DF,選手,中学生,三年生,無所属,すぐに　パスワードを忘れてしまうためオンラインゲームにログインできなくなる。,×,×,×,×,○,○,×,×,○,79,83,84,91,95,81,104,162,187,188,199,195,186,791
3867,二四中 常太,常太,男,林,FW,選手,中学生,二年生,無所属,２４時間　戦い続けるサッカー戦士。いつも元気な　あいさつが気持ちいい。,×,×,×,×,○,○,×,×,○,114,108,98,81,78,78,86,222,194,184,164,167,159,708
3868,板屋 江戸丸,江戸丸,男,風,FW,選手,中学生,二年生,無所属,お寿司が大好きなサッカー少年。ワサビのように　ピリリと辛いプレイをする。,×,×,×,×,○,○,×,×,○,110,104,95,77,75,75,83,214,187,178,158,160,152,679
3869,南乃 武虎,なむとら,男,火,MF,選手,中学生,二年生,無所属,ゲームが大好きな　サッカー少年。ゲームの腕なら　誰にも負けないのだとか。,×,×,×,×,○,○,×,×,○,90,104,105,77,75,75,93,194,197,198,168,170,152,679
3870,風来 歩馬,歩馬,男,山,FW,選手,中学生,一年生,無所属,どこにでも現れる　風来のサッカー少年。ハンバーガーと　フライドポテトが大好物。,×,×,×,×,○,○,×,×,○,104,101,91,81,78,75,90,205,191,181,168,171,159,696
3871,富礼野 美久,ふれいく,女,山,DF,選手,中学生,一年生,無所属,スタンプラリーに参加するのが趣味。こう見えても　実は押しの強い性格。,×,×,×,×,○,○,×,×,○,76,79,77,95,99,81,110,155,189,187,209,205,194,811
3872,桃山 ミコ,ももミ,女,火,DF,選手,中学生,一年生,無所属,ピンクのスカーフは　幸せの証。ご存知　みんなのアイドル桃レンジャー。,×,×,×,×,○,○,×,×,○,76,79,77,95,99,81,110,155,189,187,209,205,194,811
3873,赤城 一斗,赤城,男,風,FW,選手,中学生,三年生,無所属,真っ赤なハートに　たなびくスカーフ！ご存知　燃えるハートの赤レンジャー！,×,×,×,×,○,○,×,×,○,110,104,95,77,75,75,83,214,187,178,158,160,152,679
3874,青野 浩二,青野,男,林,GK,選手,中学生,二年生,無所属,ブルーの瞳が鋭く光る！ご存知　いつもクールな青レンジャー！,×,×,×,×,○,○,×,×,○,79,86,81,88,95,101,86,165,172,167,181,174,183,865
3875,シンク・ログラム,ろぐらむ,男,林,MF,選手,中学生,二年生,無所属,自称　未来からきたカードの伝道師。サスＫに多大な期待と信頼を寄せる。,×,×,×,×,○,○,×,×,○,93,101,98,81,82,75,90,194,191,188,172,171,163,708
3876,Ｃグマ,でんどうし,女,火,DF,選手,中学生,二年生,サブキャラクター,カードバトル界の　悪の伝道師。サスＫの　ライバルとも言える存在だ。,×,×,×,×,○,○,×,×,○,79,83,84,91,95,81,104,162,187,188,199,195,186,791
3878,,,-,-,-,-,-,-,-,-,,,,,,,,,,0,0,0,0,0,0,0,0,0,0,0,0,0,0
3879,,,-,-,-,-,-,-,-,-,,,,,,,,,,0,0,0,0,0,0,0,0,0,0,0,0,0,0
3880,,,-,-,-,-,-,-,-,-,,,,,,,,,,0,0,0,0,0,0,0,0,0,0,0,0,0,0
3881,,,-,-,-,-,-,-,-,-,,,,,,,,,,0,0,0,0,0,0,0,0,0,0,0,0,0,0
